"PMID","Title","abstract"
"26566043","Blood Biomarkers Associated with Cognitive Decline in Early Stage and Drug-Naive Parkinson's Disease Patients.","Early diagnosis of Parkinson's disease (PD) continues to be a major challenge in the field. The lack of a robust biomarker to detect early stage PD patients has considerably slowed the progress toward the development of potential therapeutic agents. We have previously evaluated several RNA biomarkers in whole blood from participants enrolled in two independent clinical studies. In these studies, PD patients were medicated, thus, expression of these biomarkers in de novo patients remains unknown. To this end, we tested ten RNA biomarkers in blood samples from 99 untreated PD patients and 101 HC nested in the cross-sectional Parkinson's Progression Markers Initiative by quantitative real-time PCR. One biomarker out of ten, COPZ1 trended toward significance (nominal p = 0.009) when adjusting for age, sex, and educational level. Further, COPZ1, EFTUD2 and PTBP1 mRNAs correlated with clinical features in PD patients including the Hoehn and Yahr scale, Movement Disorder Society revision of Unified Parkinson's Disease Rating Scale (MDS-UPDRS) and Montreal Cognitive Assessment (MoCA) score. Levels of EFTUD2 and PTBP1 were significantly higher in cognitively normal PD patients (PD-CN) compared to cognitively impaired PD patients (PD-MCI). Interestingly, blood glucose levels were significantly higher in PD and PD-MCI patients (= 100 mg/dL, pre-diabetes) compared to HC. Collectively, we report the association of three RNA biomarkers, COPZ1, EFTUD2 and PTBP1 with clinical features including cognitive decline in early drug-naïve PD patients. Further, our results show that drug-naïve PD and PD-MCI patients have glucose levels characteristic of pre-diabetes patients, suggesting that impaired glucose metabolism is an early event in PD. Evaluation of these potential biomarkers in a larger longitudinal study is warranted. "
"26530222","Relationship between glycated hemoglobin A1c and cognitive function in nondemented elderly patients with type 2 diabetes.","Elderly patients with type 2 diabetes are at a greater risk for cognitive decline. The purpose of this study was to assess the relationship between the degree of hyperglycemia and cognitive status in nondemented, elderly diabetics. Between Jan 2013 and Dec 2014, 1174 geriatric patients with type 2 diabetes were enrolled in the study (579 males; age = 60 years; from Fuzhou, Fujian, China). Cognitive function was measured with the Mini Mental State Examination (MMSE) and Montreal Cognitive Assessment (MoCA). A statistically significant, age-adjusted association was observed between the A1C levels and the scores on two cognitive tests (MMSE and MoCA). Specifically, a 1% higher A1C value was associated with a 0.21-point lower MMSE score (95% CI; compare -0.11 to -0.28; P &lt; 0.0001), as well as a 0.11-point lower MoCA score (95% CI; compare -0.10 to -0.38; P &lt; 0.0001). Higher A1C levels were not significantly associated with lower MMSE and MoCA test scores after adjusting for all variables. No significant correlation was found between the two variables in patients older than 80 years of age (n = 215; OR = 1.019; 95% CI = 0.968 - 1.099; p = 0.251). Evidence strongly suggests that chronic hyperglycemia is associated with a decline in cognitive function in nondemented elderly patients with type 2 diabetes. When cognitive assessments are made, comprehensive factors such as advanced age, education level, duration of diabetes, hypertension and other vascular risks should be taken into account. For older geriatric patients (age = 80 years), there is no significant correlation between A1c levels and cognitive function."
"26499758","Association of type 2 diabetes GWAS loci and the risk of Parkinson's and Alzheimer's diseases.","BACKGROUND: Insulin and insulin-like growth factor contribute to normal brain function. Recent experimental and clinical studies showed that type 2 diabetes mellitus (T2DM) and Parkinson's disease (PD) or Alzheimer's disease (AD) share several dysregulated pathways.OBJECTIVE: We aimed to investigate whether genome-wide significant loci of T2DM are associated with the risk of PD and AD as well as the severity of cognitive impairment.METHODS: Study subjects were 500 PD patients, 400 AD patients, and 500 unrelated controls. We selected 32 genetic variants from 11 genes (CDC123, CDKAL1, CDKN2B, FTO, GLIS3, HHEX, IGF2BP2, KCNJ11, KCNQ1, SLC30A8, and TCF7L2) and intergenic regions based on results of recent genome-wide association studies (GWAS) in T2DM. These variants were reported to be T2DM-susceptibility loci and have been replicated in other independent studies. All association analyses were performed using logistic regression models, adjusting for age and sex.RESULTS: KCNQ1 SNP rs163182 showed the strongest association with AD, but it was not significant after Bonferroni correction (OR = 1.30, 95% CI = 1.07-1.59, Pcorrected = 0.32). In PD patients, CDC123 SNP rs11257655 showed modest association with MMSE score &lt;26, and CDKN2B SNPs (rs2383208, rs10965250, and rs10811661) showed modest association with MoCA score &lt;26, which were not significant after Bonferroni correction. Other genetic variants had no association with the risk of PD or AD and the severity of cognitive impairment.CONCLUSIONS: Our results suggest that genome-wide significant loci of T2DM play no major role in the risk and cognitive impairment of PD and AD."
"26289518","Mini-mental state exam versus Montreal Cognitive Assessment in patients with diabetic retinopathy.","BACKGROUND: Mini-mental state exam (MMSE) was used several times but no study has examined cognition on the Montreal Cognitive Assessment (MoCA) in diabetes and diabetic retinopathy (DR). In this study, we compared MMSE with MoCA in patients with DR and searched for an association between the severity of DR and cognitive impairment (CI).METHODS: This cross-sectional study comprised 120 consecutive patients with diabetes. Patients were divided into four groups as no DR, mild DR, severe nonproliferative DR (PDR) and PDR. Each group consisted 30 inviduals. CI was assessed using the MMSE and MoCA.RESULTS: The number of subjects with a score&gt;21 were significantly lower on the MoCA than on the MMSE between groups (all P&lt;0.05). The mean MoCA score was significantly lower than the MMSE score (P&lt;0.001) There was a linear association between the grade of DR and a score&lt;21 on both tests,CONCLUSION: MoCA provides more insight into the cognitive function in DR."
"26211240","[Multi-channel Synchronization Analysis of Mild Cognitive Impairment in Type 2 Diabetes Patients].","The cognitive impairment of type 2 diabetes patients caused by long-term metabolic disorders has been the current focus of attention. In order to find the related electroencephalogram (EEG) characteristics to the mild cognitive impairment (MCI) of diabetes patients, this study analyses the EEG synchronization with the method of multichannel synchronization analysis--S estimator based on phase synchronization. The results showed that the S estimator values in each frequency band of diabetes patients with MCI were almost lower than that of control group. Especially, the S estimator values decreased significantly in the delta and alpha band, which indicated the EEG synchronization decrease. The MoCA scores and S value had a significant positive correlation in alpha band."
"26169667","Cognitive function and left ventricular assist device implantation.","BACKGROUND: Cognitive impairment is frequent in patients with heart failure (HF) and can lead to poor quality of life and increased risk of mortality. The Montreal Cognitive Assessment (MoCA) is a simple screening tool that is sensitive to mild cognitive impairment (MCI) and that has been validated in the settings of neurologic and cardiovascular disease. This study determined the extent of cognitive impairment in patients with HF undergoing evaluation for advanced surgical therapy and evaluated changes in MoCA score with follow-up cognitive assessment at 8 months after left ventricular assist device (LVAD) implantation.METHODS: As part of routine assessment for LVAD candidacy, 176 patients with advanced HF were administered the MoCA; 56 patients were reevaluated 8 months after LVAD implantation.RESULTS: Patients with MCI, indicated by MoCA score &lt;26 out of 30, made up 67% of the study cohort. MCI was associated with significantly older age, higher CHADS2 (congestive HF, hypertension, age &gt;75 years, diabetes mellitus, prior stroke or transient ischemic attack) risk score, statin use, history of stroke and hypertension, and reduced serum cholesterol levels. In 56 patients who underwent follow-up evaluation after LVAD implantation, total MoCA score and visuospatial, executive, and delayed recall cognitive domains were significantly improved.CONCLUSIONS: This study assessed the use of the MoCA in patients with end-stage HF being evaluated for advanced surgical therapy. We found the MoCA to be a rapid, simple, and powerful tool for detecting cognitive impairment in these patients. MCI was highly prevalent in the cohort. Significant improvement in overall MoCA score was noted after LVAD implantation."
"26167502","Serum Soluble Adhesion Molecules and Markers of Systemic Inflammation in Elderly Diabetic Patients with Mild Cognitive Impairment and Depressive Symptoms.","The aim of the study was to determine the serum levels of soluble adhesion molecules and hs-CRP in elderly diabetics with mild cognitive impairment (MCI) alone or with depressive symptoms. Methods. 219 diabetics elders were screened for psychiatric disorders and divided: group 1, MCI without depressive mood; group 2, MCI with depressive mood; group 3, controls. Data of biochemical parameters and biomarkers were collected. Results. In groups 1 and 2 levels of all biomarkers were significantly higher as compared to controls. The highest level of hs-CRP and sICAM-1 was detected in group 2. SVCAM-1 and sE-selectin levels were also the highest in group 2; however they did not significantly differ as compared to group 1. MoCA score was negatively correlated with all biomarkers in group 1. The logistic regression model showed that variables which increased the likelihood of having depressive syndrome in MCI patients were older age, stroke, neuropathy, increased number of comorbidities, and higher sICAM-1 level. Conclusions. We first demonstrated that elderly diabetic patients with MCI, particularly those with depressive mood have higher levels of soluble adhesion molecules and markers of low-grade systemic inflammation. Coexisting depressive syndrome in patients with MCI through common inflammatory pathways may result in augmentation of psychiatric disorders. "
"26142624","Metabolic syndrome correlates poorly with cognitive performance in stroke-free community-dwelling older adults: a population-based, cross-sectional study in rural Ecuador.","BACKGROUND: Studies investigating a possible correlation between metabolic syndrome and cognitive decline have been inconsistent.AIMS: To determine whether metabolic syndrome or each of its components correlate with cognitive performance in community-dwelling older adults in rural Ecuador.METHODS: Stroke-free Atahualpa residents aged =60 years were identified during a door-to-door survey. Metabolic syndrome was defined according to the International Diabetes Federation criteria. Cognition was evaluated by the use of the Montreal Cognitive Assessment (MoCA). Multivariate logistic regression models estimated the association between metabolic syndrome and each of its components with cognitive performance.RESULTS: A total of 212 persons (mean age: 69.2 ± 7.2 years, 64 % women) were enrolled. Of these, 120 (57 %) had metabolic syndrome. Mean scores in the MoCA were 18.2 ± 4.6 for persons with and 19 ± 4.7 for those without metabolic syndrome. In fully adjusted logistic models, MoCA scores were not associated with metabolic syndrome (p = 0.101). After testing individual components of metabolic syndrome with the MoCA score, we found that only hypertriglyceridemia was independently associated with the MoCA score (p = 0.009).CONCLUSIONS: This population-based study showed a poor correlation of metabolic syndrome with cognitive performance after adjusting for relevant confounders. Of the individual components of metabolic syndrome, only hypertriglyceridemia correlated with worse cognitive performance."
"26067432","Effect of Carotid Artery Stenting on Cognitive Function in Patients with Internal Carotid Artery Stenosis and Cerebral Lacunar Infarction: A 3-Year Follow-Up Study in China.","BACKGROUND AND OBJECTIVES: Carotid artery stenting (CAS) is an important therapeutic strategy for patients with carotid artery stenosis. However, the potential influence of CAS on cognitive function in patients with carotid artery stenosis and cerebral lacunar infarction has not been determined. This study investigated changes in cognitive function associated with CAS and the factors related to these changes.METHODS: This prospective cohort study comprised 579 Chinese patients with cerebral lacunar infarction and carotid artery stenosis for whom CAS was indicated, and a matched control group of 552 healthy individuals. Cognitive function before CAS and at scheduled intervals from 6 months to 3 years was assessed with instruments that included the Mini-Mental State Examination (MMSE) and Montreal Cognitive Assessment (MoCA) scale. Potential factors that might affect cognitive function were analyzed via logistic regression.RESULTS: The MMSE and MoCA scores of the patients before CAS were significantly lower than that of the control subjects. These scores were significantly higher 6 months after CAS and sustained or increased throughout the 3-year follow-up. Also significantly improved after CAS from baseline were scores for an alternating trail test, cube copying, clock-drawing, attention, and delayed recall in an auditory-verbal learning test. Logistic regression analyses showed that age greater than 65 y, little education, diabetes, and hypertension were independent risk factors for deteriorated MoCA scores 3 years after CAS.CONCLUSION: CAS was associated with significantly improved cognitive function in cerebral lacunar infarction patients with severe stenosis."
"26062587","[Diabetes and Dementia].","An aging global population is driving the current epidemic of dementia and type 2 diabetes mellitus. Diabetes is a known risk factor for the development of vascular dementia, Alzheimer's disease, and mild cognitive impairment. Good control of diabetes may improve cognitive decline and prevent Alzheimer's disease. Mild cognitive impairment with type 2 diabetes (DM-MCI) often presents as a decline in attention, psychomotor speed, executive function, and memory. The Montreal Cognitive Assessment (MoCA) is one of the best screening tools for detecting DM-MCI. We found that 72% of the patients admitted to educational hospitalization for type 2 diabetes could also be categorized into groups with frontal lobe dysfunction, delayed recall, and a mixed-type group. Anti-diabetic drugs and insulin may protect and improve cognitive dysfunction in Alzheimer's disease and DM-MCI, but more studies are needed to verify this claim. Diabetes mellitus may be linked not only to Alzheimer's disease but also to other neurodegenerative diseases, such as Parkinson's, Huntington's and frontotemporal lobe dementia. "
"26000804","The use of MMSE and MoCA in patients with acute ischemic stroke in clinical.","BACKGROUND: The Mini-Mental State Examination (MMSE) and the Montreal Cognitive Assessment (MoCA) are brief cognitive screening tools that have been developed for the screening of patients with Mild Cognitive Impairment.METHODS: A total of 105 patients were included in this study, aged 53-89 years, with acute ischemic stroke admitted to hospital and fell into two groups: stroke patients with cognitive impairment (SCI) and controls with no cognitive impairment (n-SCI). The patient's characteristics are collected and regression analyses were performed to predict cognitive impairments. We use MMSE and MoCA assessment as prognostic indices for cognitive impairments of patient's with stroke.OBJECTIVES: Our aim was to examine the effectiveness of the MMSE and MoCA in screening cognitive impairments.MAIN RESULTS: There were significant difference among the two groups in the prevalence of diabetes mellitus (p &lt; 0.05) and intracranial atherosclerosis (p &lt; 0.05). A linear regression determined that the age, diabetes, intracranial atherosclerosis predicted the cognitive impairments. The ROC results for MoCA with an AUC of 0.882 and the corresponding results for MMSE show a similar AUC of 0.839.CONCLUSION: Neuropsychological performance of stroke patients was influenced by biological and demographic variables: age, diabetes and intracranial atherosclerosis. The MoCA and MMSE are both reliable assessments for the diagnosis of cognitive impairment after stroke."
"25962184","Mild cognitive impairment: vascular risk factors in community elderly in four cities of Hebei Province, China.","BACKGROUND: Evidence has demonstrated that vascular risk factors (VRFs) contribute to mild cognitive impairment (MCI) in the elderly population. Because of the race and different diagnosis standard, there is still no definitive conclusions.OBJECTIVE: To estimate the VRFs and potential protective factors for MCI in elderly population living in the community in North China.METHODS: A total of 3136 participants entered the study. They were screened for hypertension, coronary heart disease (CHD), and cerebrovascular disease (CVD). Cognitive function was assessed with Mini-Mental State Examination (MMSE) and the Montreal Cognitive Assessment (MoCA). The diagnosis of MCI was made according to Petersen's criteria. We investigated the relationship between vascular risk factors, potential protective factors and MCI.RESULTS: A total of 2511 (80%) participant belonged to normal group and 625 (20%) participants showed MCI. Multiple logistic regression analysis demonstrated that stroke and diabetes, but not hypertension or CHD was associated with MCI. Besides, exercise habit could lower the risk of MCI.CONCLUSIONS: Vascular Risk Factors, including stroke and diabetes, rather than hypertension and CHD are independent risk factors of MCI. Involvement in physical activities seems to reduce the risk of MCI."
"25933475","Effects of Carotid Endarterectomy on Cerebral Reperfusion and Cognitive Function in Patients with High Grade Carotid Stenosis: A Perfusion Weighted Magnetic Resonance Imaging Study.","OBJECTIVE: To investigate the influence of carotid endarterectomy (CEA) on cerebral perfusion and cognitive function in patients with internal carotid artery stenosis (ICA).METHODS: Patients were prospectively enrolled in this study. Shunted patients were excluded. Cerebral perfusion was measured by magnetic resonance (MR) perfusion weighted imaging (PWI) and diffusion weighted imaging (DWI) in 46 patients with &gt;65% ICA (31 males, 64.5 ± 6.7 years) 1 week before and 6 weeks after CEA. Cognitive function was assessed using the Mini Mental State Examination (MMSE) and the Montreal Cognitive Assessment (MoCA) 1 week before and 6 weeks after CEA.RESULTS: After CEA, perfusion parameters from PWI decreased, including mean transit time (MTT) (21.07 ± 7.36 vs. 14.27 ± 6.22, p &lt; .0001), time to peak (TTP) (28.69 ± 8.54 vs. 23.45 ± 4.25, p = .001), arrive time (T0) (19.89 ± 7.32 vs. 15.20 ± 3.51, p = .001), and relative cerebral blood volume (rCBV) (11.48 ± 3.50 vs. 7.53 ± 3.17, p &lt; .0001). A significant improvement was observed in MoCA (20.48 ± 1.70 vs. 22.04 ± 1.48, p = .001). Spearman's rank correlation analysis between TTP and MoCA scores demonstrated a linear relationship with an excellent correlation coefficient (R = -.893, p &lt; .001). Linear regression indicated that diabetes was a risk factor for cognitive improvement in patients with ICA (p = .014). Further analysis showed that patients with DM performed worse in MoCA after the procedure (with-DM 21.15 ± 1.28 vs. non-DM 22.4 ± 1.46, p = .010) while the baselines were similar (non-DM: 20.3 ± 1.8 vs. with-DM: 20.9 ± 1.4, p = .362).CONCLUSION: CEA could improve the cerebral perfusion and the cognitive function in un-shunted ICA patients. Cerebral reperfusion was an important factor for cognitive improvement. Diabetes had a negative effect on cognitive improvement after CEA."
"25875132","Patients with type 2 diabetes exhibit cognitive impairment with changes of metabolite concentration in the left hippocampus.","Type 2 diabetes mellitus (T2DM) is associated with cognitive dysfunction. Previous studies have reported the relationship between cerebral metabolite changes and glucose levels. However, the specific aspects of cognition that are affected by metabolic changes in T2DM- related cognitive impairment remain undetermined. In this study, 188 T2DM patients and 266 controls were recruited. Proton magnetic resonance spectra with a single voxel stimulated echo acquisition mode (STEAM) were acquired from the left hippocampus and the frontal lobe. Presence of T2DM negatively affected the scores of Mini-Mental State Examination (MMSE), sub-tests (i.e., attention and language) of MMSE, Montreal Cognitive Assessment (MoCA) according to the Beijing version, and sub-tests (i.e., visuospatial/executive reasoning, attention, and language) of MoCA, rather than the Wechsler Memory Scale - Revised in China (WMS-RC), and all memory sub-tests contained with the MMSE and MoCA frameworks. T2DM positively affected creatine and myoinositol peak areas from the left hippocampus, rather than metabolites in the left frontal lobe. Negative correlations were shown between the left hippocampal myoinositol levels and language scores, and between the left hippocampal creatine levels and visuospatial/executive scores in T2DM. These findings suggest that T2DM may be an independent risk factor for cognitive impairment. Further, the cognitive domains of visuospatial /executive reasoning, attention and language may be predominantly impaired in the early phases of T2DM-related cognitive impairment. In addition, left hippocampal myoinositol and creatine concentrations were associated with cognitive impairment in patients with T2DM. "
"25868060","Evaluation of cognitive functions in gestational diabetes mellitus.","OBJECTIVE: To evaluate the association between cognitive functions and metabolic status in cases with gestational diabetes mellitus (GDM).METHODS: In this study 44 patients with GDM and 45 normal pregnant were included. Depression was evaluated with Beck's depression inventory (BDI). Cognitive functions were evaluated with Montreal cognitive assessment (MOCA), paced auditory serial addition test (PASAT), spatial recall test (SRT), symbol digit modalities (SDMT), and word list generation (WLG).RESULTS: The mean gestational age, educational level and account of previous birth of the subjects in the study were not statistically different between the groups. The mean scores of BDI of the 2 groups were not statistically different. MOCA score and SDMT was significantly decreased in GDM in comparison to NP (p=0.005, p=0.04 respectively). Also, SDMT score was inversely correlated with number of pregnancies, postprandial blood glucose and HbA1c.The scores of PASAT, SRT, SPART and WLG were statistically similar between the groups.CONCLUSIONS: Our findings may be a clue for early onset of impairment in cognitive functions in cases with new onset diabetes during pregnancy."
"25793613","Serum levels of inflammatory markers in depressed elderly patients with diabetes and mild cognitive impairment.","OBJECTIVE: The aim of the study was to determine the serum levels of CRP, IL-6 and TNF-a in elderly diabetic patients with depressive syndrome alone or with coexisting mild cognitive impairment (MCI).METHODS: 276 diabetics elders were screened for depressive symptoms (using Geriatric Depression Scale: GDS-30) and MCI (using the Montreal Cognitive Assessment: MoCA score). Data of HbA1c, blood lipids and inflammatory markers levels were collected.RESULTS: In all groups of patients levels of CRP, IL-6 and TNF-a were significantly higher as compared to controls. The highest level of inflammatory markers was detected in group with depressive mood and coexisting MCI, however IL-6 level didn't significantly differ as compared to MCI group. We founded correlations between all inflammatory markers in group of patients with depressive mood and in group of subjects with depressive symptoms and coexisting MCI. GDS-30 score was correlated with levels of inflammatory markers in group with depressive mood, and with levels of CRP and TNF-a in group with depressive mood and coexisting MCI. In the group with depressive mood and coexisting MCI we founded that MoCA score was negatively correlated with CRP and TNF-a levels; and HbA1c level was positively correlated with all inflammatory markers. The univariate logistic regression models revealed that variables which increased the likelihood of having been diagnosed with MCI in depressed patients were: higher levels of HbA1c, CRP, IL-6 and TNF-a, previous CVD or stroke, increased number of co-morbidities and microvascular complications, older age, less years of formal education. The multivariable model showed that previous CVD, higher HbA1c and IL-6 levels are significant factors.CONCLUSIONS: We demonstrated that the presence of depressive syndrome is associated with higher levels of inflammatory markers in elderly patients with diabetes. The presence of MCI in these depressed subjects has additive effect on levels of inflammatory mediators."
